{
  "schema_version":"1.0",
  "catalog_id":"LS-MESSAGE-CATALOG-PRODUCTION-CANDIDATE",
  "catalog_version":"1.0",
  "effective_at":"2026-10-04T00:00:00+03:00",
  "enabled_locales":["uk-UA","ru-RU"],
  "fallback_locale":"uk-UA",
  "messages":[
    {"user_message_code":"SOURCE_DELTA_NO_CHANGE","severity":"INFO","allowed_action":"VIEW_DUPLICATE_COUNTS","texts":{"uk-UA":"Нові матеріали не змінили Паспорт SKU.","ru-RU":"Новые материалы не изменили Паспорт SKU."}},
    {"user_message_code":"PASSPORT_UPDATE_CONFIRMED","severity":"SUCCESS","allowed_action":"OPEN_UPDATED_PASSPORT","texts":{"uk-UA":"Паспорт SKU оновлено.","ru-RU":"Паспорт SKU обновлён."}},
    {"user_message_code":"PASSPORT_DECISION_REQUIRED","severity":"WARNING","allowed_action":"OPEN_REQUIRED_DECISION","texts":{"uk-UA":"Для продовження потрібне рішення щодо виявленої розбіжності.","ru-RU":"Для продолжения требуется решение по выявленному расхождению."}},
    {"user_message_code":"SOURCE_WRONG_SKU_OR_SCOPE","severity":"ERROR","allowed_action":"CORRECT_SKU_OR_SCOPE","texts":{"uk-UA":"Матеріали не відповідають вибраному SKU або області запиту.","ru-RU":"Материалы не соответствуют выбранному SKU или области запроса."}},
    {"user_message_code":"SOURCE_ROUTED_TO_STANDARDS","severity":"INFO","allowed_action":"OPEN_ROUTING_RECEIPT","texts":{"uk-UA":"Матеріали передано до контуру стандартів; Паспорт SKU не змінено.","ru-RU":"Материалы переданы в контур стандартов; Паспорт SKU не изменён."}},
    {"user_message_code":"PASSPORT_RECREATE_ACCEPTED","severity":"INFO","allowed_action":"OPEN_OPERATION_STATUS","texts":{"uk-UA":"Повну заміну Паспорта прийнято в роботу. Чинний Паспорт залишається активним до завершення.","ru-RU":"Полная замена Паспорта принята в работу. Действующий Паспорт остаётся активным до завершения."}},
    {"user_message_code":"PASSPORT_RECREATE_ALREADY_RUNNING","severity":"INFO","allowed_action":"OPEN_EXISTING_OPERATION","texts":{"uk-UA":"Для цього SKU вже виконується повна заміна Паспорта.","ru-RU":"Для этого SKU уже выполняется полная замена Паспорта."}},
    {"user_message_code":"PASSPORT_RECREATE_COMMITTED","severity":"SUCCESS","allowed_action":"OPEN_NEW_PASSPORT","texts":{"uk-UA":"Новий Паспорт SKU активовано; попередню версію архівовано.","ru-RU":"Новый Паспорт SKU активирован; предыдущая версия архивирована."}},
    {"user_message_code":"PASSPORT_RECREATE_ROLLED_BACK","severity":"WARNING","allowed_action":"OPEN_RECOVERY_RECEIPT","texts":{"uk-UA":"Заміну скасовано. Попередній Паспорт залишається активним.","ru-RU":"Замена отменена. Предыдущий Паспорт остаётся активным."}},
    {"user_message_code":"REQUEST_SCHEMA_INVALID","severity":"ERROR","allowed_action":"CORRECT_REQUEST","texts":{"uk-UA":"Запит має неповні або некоректні дані.","ru-RU":"Запрос содержит неполные или некорректные данные."}},
    {"user_message_code":"ACTOR_NOT_AUTHORIZED","severity":"ERROR","allowed_action":"REQUEST_AUTHORITY_REVIEW","texts":{"uk-UA":"У користувача немає повноважень для цієї дії.","ru-RU":"У пользователя нет полномочий для этого действия."}},
    {"user_message_code":"STALE_PASSPORT_INPUT","severity":"WARNING","allowed_action":"REFRESH_PASSPORT_SNAPSHOT","texts":{"uk-UA":"Паспорт змінився після підтвердження. Оновіть дані та повторіть підтвердження.","ru-RU":"Паспорт изменился после подтверждения. Обновите данные и повторите подтверждение."}},
    {"user_message_code":"NO_ACCEPTED_SOURCE_OBJECTS","severity":"ERROR","allowed_action":"SELECT_ACCEPTABLE_MATERIALS","texts":{"uk-UA":"Жоден вибраний файл не прийнято.","ru-RU":"Ни один выбранный файл не принят."}},
    {"user_message_code":"INTAKE_POLICY_NOT_CONFIGURED","severity":"ERROR","allowed_action":"CONTACT_INTEGRATION_OWNER","texts":{"uk-UA":"Правила приймання файлів не налаштовані.","ru-RU":"Правила приёма файлов не настроены."}},
    {"user_message_code":"IDEMPOTENCY_KEY_CONFLICT","severity":"ERROR","allowed_action":"INVESTIGATE_REQUEST_CONFLICT","texts":{"uk-UA":"Повторний запит не збігається з початковим. Потрібна перевірка.","ru-RU":"Повторный запрос не совпадает с исходным. Требуется проверка."}},
    {"user_message_code":"RECREATE_CONFIRMATION_MISSING","severity":"WARNING","allowed_action":"COMPLETE_CONFIRMATIONS","texts":{"uk-UA":"Для повної заміни потрібні два підтвердження.","ru-RU":"Для полной замены требуются два подтверждения."}},
    {"user_message_code":"RECREATE_CONFIRMATION_EXPIRED","severity":"WARNING","allowed_action":"REPEAT_CONFIRMATIONS","texts":{"uk-UA":"Строк дії підтверджень завершився. Повторіть обидва підтвердження.","ru-RU":"Срок действия подтверждений истёк. Повторите оба подтверждения."}},
    {"user_message_code":"RECREATE_CONFIRMATION_MISMATCH","severity":"ERROR","allowed_action":"REPEAT_CONFIRMATIONS","texts":{"uk-UA":"Підтвердження належать різним запитам або версіям Паспорта.","ru-RU":"Подтверждения относятся к разным запросам или версиям Паспорта."}},
    {"user_message_code":"PASSPORT_MUTATION_LOCKED","severity":"INFO","allowed_action":"OPEN_ACTIVE_OPERATION","texts":{"uk-UA":"Паспорт тимчасово заблоковано іншою операцією.","ru-RU":"Паспорт временно заблокирован другой операцией."}},
    {"user_message_code":"RECREATE_PREFLIGHT_FAILED","severity":"ERROR","allowed_action":"CORRECT_PREFLIGHT_FINDING","texts":{"uk-UA":"Перевірку перед повною заміною не пройдено.","ru-RU":"Проверка перед полной заменой не пройдена."}},
    {"user_message_code":"CONTRACT_COMPATIBILITY_ERROR","severity":"ERROR","allowed_action":"CONTACT_INTEGRATION_OWNER","texts":{"uk-UA":"Інтерфейс отримав невідомий результат. Операцію зупинено.","ru-RU":"Интерфейс получил неизвестный результат. Операция остановлена."}},
    {"user_message_code":"AUTHORITY_PROFILE_NOT_ACTIVE","severity":"ERROR","allowed_action":"CONTACT_IDENTITY_OWNER","texts":{"uk-UA":"Профіль повноважень не активований.","ru-RU":"Профиль полномочий не активирован."}},
    {"user_message_code":"AUTHORITY_NOT_MAPPED","severity":"ERROR","allowed_action":"REQUEST_ACCESS_MAPPING","texts":{"uk-UA":"Обліковий запис не прив'язано до ролі Listing Suite.","ru-RU":"Учётная запись не привязана к роли Listing Suite."}},
    {"user_message_code":"ACTION_NOT_AUTHORIZED","severity":"ERROR","allowed_action":"REQUEST_AUTHORITY_REVIEW","texts":{"uk-UA":"Призначена роль не дозволяє цю дію.","ru-RU":"Назначенная роль не разрешает это действие."}},
    {"user_message_code":"SKU_SCOPE_DENIED","severity":"ERROR","allowed_action":"SELECT_AUTHORIZED_SKU","texts":{"uk-UA":"Користувач не має доступу до цього SKU.","ru-RU":"У пользователя нет доступа к этому SKU."}},
    {"user_message_code":"IDENTITY_NOT_VERIFIED","severity":"ERROR","allowed_action":"SIGN_IN_AGAIN","texts":{"uk-UA":"Не вдалося підтвердити обліковий запис користувача.","ru-RU":"Не удалось подтвердить учётную запись пользователя."}}
  ],
  "approved_by":"PROJECT_OWNER",
  "catalog_sha256":"5517cf7cf0cfd4775a6f65d66070ff4e7f2724738529acf6040d49f76c438fca"
}
